{
  "type": "screen",
  "source": {
    "layout": "fixtures/GradientView/orientation__vertical.layout.json"
  },
  "metadata": {
    "name": "conformance GradientView.orientation (vertical)",
    "description": "Conformance fixture for 'orientation' on GradientView (section: GradientView, class: visual). Value under test: \"vertical\".",
    "generatedBy": "@generated jui conformance generate — DO NOT EDIT",
    "tags": [
      "conformance",
      "GradientView"
    ]
  },
  "platform": [
    "web"
  ],
  "cases": [
    {
      "name": "orientation__vertical",
      "description": "Conformance fixture for 'orientation' on GradientView (section: GradientView, class: visual). Value under test: \"vertical\".",
      "steps": [
        {
          "action": "waitFor",
          "id": "root"
        },
        {
          "action": "screenshot",
          "name": "GradientView_orientation__vertical"
        }
      ]
    }
  ]
}
