{
  "type": "screen",
  "source": {
    "layout": "fixtures/common/visibility__invisible.layout.json"
  },
  "metadata": {
    "name": "conformance common.visibility (invisible)",
    "description": "Conformance fixture for 'visibility' on View (section: common, class: assertable). Value under test: \"invisible\".",
    "generatedBy": "@generated jui conformance generate — DO NOT EDIT",
    "tags": [
      "conformance",
      "common"
    ]
  },
  "platform": "all",
  "cases": [
    {
      "name": "visibility__invisible",
      "description": "Conformance fixture for 'visibility' on View (section: common, class: assertable). Value under test: \"invisible\".",
      "steps": [
        {
          "action": "waitFor",
          "id": "root"
        },
        {
          "assert": "notVisible",
          "id": "target"
        },
        {
          "assert": "hidden",
          "id": "target"
        }
      ]
    }
  ]
}
