{
  "type": "screen",
  "source": {
    "layout": "fixtures/ScrollView/childGravity__right.layout.json"
  },
  "metadata": {
    "name": "conformance childGravity__right",
    "description": "A 200x200 vertical ScrollView holding one 40x40 box that declares gravity right: the box's gravity is its own content's, so the box stays at x 0. A platform that places the child by its gravity draws it at x 160.",
    "generatedBy": "@generated jui conformance generate — DO NOT EDIT",
    "tags": [
      "conformance",
      "ScrollView"
    ]
  },
  "platform": "all",
  "cases": [
    {
      "name": "childGravity__right",
      "description": "A 200x200 vertical ScrollView holding one 40x40 box that declares gravity right: the box's gravity is its own content's, so the box stays at x 0. A platform that places the child by its gravity draws it at x 160.",
      "steps": [
        {
          "action": "waitFor",
          "id": "root"
        },
        {
          "action": "screenshot",
          "name": "ScrollView_childGravity__right"
        }
      ]
    }
  ]
}
