{
  "type": "screen",
  "source": {
    "layout": "fixtures/TextView/keyboardType__email.layout.json"
  },
  "metadata": {
    "name": "conformance TextView.keyboardType (email)",
    "description": "Conformance fixture for 'keyboardType' on TextView (section: TextView, class: visual). Value under test: \"email\".",
    "generatedBy": "@generated jui conformance generate — DO NOT EDIT",
    "tags": [
      "conformance",
      "TextView"
    ]
  },
  "platform": "all",
  "cases": [
    {
      "name": "keyboardType__email",
      "description": "Conformance fixture for 'keyboardType' on TextView (section: TextView, class: visual). Value under test: \"email\".",
      "steps": [
        {
          "action": "waitFor",
          "id": "root"
        },
        {
          "action": "screenshot",
          "name": "TextView_keyboardType__email"
        }
      ]
    }
  ]
}
