{
  "type": "screen",
  "source": {
    "layout": "fixtures/__control/Label__autoShrink-True_text-1d8efd05.layout.json"
  },
  "metadata": {
    "name": "conformance control Label",
    "description": "Control for Label: base attributes only, no attribute under test. Every visual fixture on this host must render differently from it — an identical render means the attribute was dropped.",
    "generatedBy": "@generated jui conformance generate — DO NOT EDIT",
    "tags": [
      "conformance",
      "control"
    ]
  },
  "platform": "all",
  "cases": [
    {
      "name": "Label__autoShrink-True_text-1d8efd05",
      "description": "Control for Label: base attributes only, no attribute under test. Every visual fixture on this host must render differently from it — an identical render means the attribute was dropped.",
      "steps": [
        {
          "action": "waitFor",
          "id": "root"
        },
        {
          "action": "screenshot",
          "name": "control_Label__autoShrink-True_text-1d8efd05"
        }
      ]
    }
  ]
}
