{
  "type": "screen",
  "source": {
    "layout": "fixtures/TextView/font__binding.layout.json"
  },
  "metadata": {
    "name": "conformance TextView.font (binding)",
    "description": "Conformance fixture for 'font' on TextView (section: TextView, class: visual). Value under test: \"@{boundFont}\".",
    "generatedBy": "@generated jui conformance generate — DO NOT EDIT",
    "tags": [
      "conformance",
      "TextView"
    ]
  },
  "platform": "all",
  "cases": [
    {
      "name": "font__binding",
      "description": "Conformance fixture for 'font' on TextView (section: TextView, class: visual). Value under test: \"@{boundFont}\".",
      "steps": [
        {
          "action": "waitFor",
          "id": "root"
        },
        {
          "action": "screenshot",
          "name": "TextView_font__binding"
        }
      ]
    }
  ]
}
