{
  "type": "screen",
  "source": {
    "layout": "fixtures/Indicator/animating__false.layout.json"
  },
  "metadata": {
    "name": "conformance Indicator.animating (false)",
    "description": "Conformance fixture for 'animating' on Indicator (section: Indicator, class: visual). Value under test: false.",
    "generatedBy": "@generated jui conformance generate — DO NOT EDIT",
    "tags": [
      "conformance",
      "Indicator"
    ]
  },
  "platform": [
    "ios",
    "android"
  ],
  "cases": [
    {
      "name": "animating__false",
      "description": "Conformance fixture for 'animating' on Indicator (section: Indicator, class: visual). Value under test: false.",
      "steps": [
        {
          "action": "waitFor",
          "id": "root"
        },
        {
          "action": "screenshot",
          "name": "Indicator_animating__false"
        }
      ]
    }
  ]
}
