{
  "type": "screen",
  "source": {
    "layout": "fixtures/common/offsetX_on_Label__static.layout.json"
  },
  "metadata": {
    "name": "conformance common.offsetX (static)",
    "description": "Conformance fixture for 'offsetX' on Label (section: common, class: visual). Value under test: 8.",
    "generatedBy": "@generated jui conformance generate — DO NOT EDIT",
    "tags": [
      "conformance",
      "common"
    ]
  },
  "platform": "all",
  "cases": [
    {
      "name": "offsetX_on_Label__static",
      "description": "Conformance fixture for 'offsetX' on Label (section: common, class: visual). Value under test: 8.",
      "steps": [
        {
          "action": "waitFor",
          "id": "root"
        },
        {
          "action": "screenshot",
          "name": "common_offsetX_on_Label__static"
        }
      ]
    }
  ]
}
