{
  "type": "screen",
  "source": {
    "layout": "fixtures/TextField/input__phone.layout.json"
  },
  "metadata": {
    "name": "conformance TextField.input (phone)",
    "description": "Conformance fixture for 'input' on TextField (section: TextField, class: visual). Value under test: \"phone\".",
    "generatedBy": "@generated jui conformance generate — DO NOT EDIT",
    "tags": [
      "conformance",
      "TextField"
    ]
  },
  "platform": "all",
  "cases": [
    {
      "name": "input__phone",
      "description": "Conformance fixture for 'input' on TextField (section: TextField, class: visual). Value under test: \"phone\".",
      "steps": [
        {
          "action": "waitFor",
          "id": "root"
        },
        {
          "action": "screenshot",
          "name": "TextField_input__phone"
        }
      ]
    }
  ]
}
