{
  "type": "screen",
  "source": {
    "layout": "fixtures/__control/View__root.orientation-horizontal.layout.json"
  },
  "metadata": {
    "name": "conformance control View",
    "description": "Control for View: base attributes only, no attribute under test. Every visual fixture on this host must render differently from it — an identical render means the attribute was dropped.",
    "generatedBy": "@generated jui conformance generate — DO NOT EDIT",
    "tags": [
      "conformance",
      "control"
    ]
  },
  "platform": "all",
  "cases": [
    {
      "name": "View__root.orientation-horizontal",
      "description": "Control for View: base attributes only, no attribute under test. Every visual fixture on this host must render differently from it — an identical render means the attribute was dropped.",
      "steps": [
        {
          "action": "waitFor",
          "id": "root"
        },
        {
          "action": "screenshot",
          "name": "control_View__root.orientation-horizontal"
        }
      ]
    }
  ]
}
